{
  "$schema": "https://json-schema.org/draft/2020-12/schema",
  "$id": "https://acme-conductor.cits-nue.github.io/schemas/v1alpha1/jobspec.schema.json",
  "title": "ACME Conductor CertificateReconcileJob v1alpha1",
  "description": "Input to one acme-runner execution. The contract carries only logical references: ASCII FQDNs only (no internationalized domain names), no secrets, no commands, images, environment variables or cloud resource identifiers. acme/dns/store are logical binding names resolved from administrator-provided configuration on the Runner side, never inline credentials or connection details. Go validation (pkg/api/v1alpha1) is authoritative and stricter than this schema; see schemas/README.md.",
  "type": "object",
  "additionalProperties": false,
  "required": ["apiVersion", "kind", "runId", "target", "policy", "acme", "dns", "store"],
  "properties": {
    "apiVersion": {
      "const": "acme-conductor.cits-nue.github.io/v1alpha1"
    },
    "kind": {
      "const": "CertificateReconcileJob"
    },
    "runId": {
      "$ref": "#/$defs/identifier",
      "description": "Opaque run identifier (e.g. a ULID or UUID). Letters, digits, '-' and '_' only."
    },
    "target": {
      "type": "object",
      "additionalProperties": false,
      "required": ["id", "fqdn", "revision"],
      "properties": {
        "id": {
          "$ref": "#/$defs/identifier",
          "description": "Opaque target identifier."
        },
        "fqdn": {
          "type": "string",
          "maxLength": 253,
          "pattern": "^(\\*\\.)?([a-z0-9]([a-z0-9-]{0,61}[a-z0-9])?\\.)+[a-z0-9]([a-z0-9-]{0,61}[a-z0-9])?$",
          "description": "Normalized ASCII FQDN (lower-case, no trailing dot), optionally with a leading '*.' wildcard label. This pattern only expresses the surface syntax. Semantic checks the Go code additionally enforces are NOT expressible in JSON Schema and are the authoritative rules: label-boundary suffix matching (e.g. 'evil-example.ac.jp' is not under 'example.ac.jp'), rejection of an all-numeric top-level label, rejection of 'xn--' (IDNA) labels, and that the value is already in normalized form."
        },
        "additionalNames": {
          "type": "array",
          "minItems": 1,
          "maxItems": 99,
          "uniqueItems": true,
          "items": {
            "type": "string",
            "maxLength": 253,
            "pattern": "^(\\*\\.)?([a-z0-9]([a-z0-9-]{0,61}[a-z0-9])?\\.)+[a-z0-9]([a-z0-9-]{0,61}[a-z0-9])?$",
            "description": "Normalized ASCII FQDN, with the same syntax and Go-only semantic checks as target.fqdn."
          },
          "description": "The certificate's other names (subject alternative names besides target.fqdn, which is the subject CN), in request order. Omit for a single-name certificate; an empty array is rejected. Go validation additionally rejects an entry equal to target.fqdn or to another entry, checks every entry against policy.allowedDnsSuffixes and policy.allowWildcard, and bounds 1 + the number of entries by policy.maxSANs; the schema cannot express those cross-field rules."
        },
        "revision": {
          "type": "integer",
          "minimum": 1,
          "description": "Optimistic-locking revision of the target at the time the job was created."
        }
      }
    },
    "policy": {
      "type": "object",
      "additionalProperties": false,
      "required": ["allowedDnsSuffixes", "allowWildcard", "renewBeforeDays", "keyType"],
      "properties": {
        "allowedDnsSuffixes": {
          "type": "array",
          "minItems": 1,
          "maxItems": 64,
          "uniqueItems": true,
          "items": {
            "type": "string",
            "maxLength": 253,
            "pattern": "^([a-z0-9]([a-z0-9-]{0,61}[a-z0-9])?\\.)+[a-z0-9]([a-z0-9-]{0,61}[a-z0-9])?$",
            "description": "Normalized ASCII DNS suffix (no wildcard, no trailing dot). See target.fqdn description for the semantic checks the schema cannot express."
          },
          "description": "Suffixes under which a certificate may be issued. Must be non-empty; duplicates are rejected by Go validation (JSON Schema's uniqueItems catches exact-string duplicates only)."
        },
        "allowWildcard": {
          "type": "boolean",
          "description": "Whether '*.name' targets are permitted. Go validation additionally cross-checks this against target.fqdn; the schema cannot express that cross-field rule."
        },
        "renewBeforeDays": {
          "type": "integer",
          "minimum": 1,
          "maximum": 365
        },
        "keyType": {
          "type": "string",
          "enum": ["ec256", "ec384", "rsa2048", "rsa3072", "rsa4096"]
        },
        "maxSANs": {
          "type": "integer",
          "minimum": 1,
          "maximum": 100,
          "description": "Maximum number of names on the certificate, target.fqdn included. Absent means 1. The Conductor sets it only on a job whose target has additionalNames."
        }
      }
    },
    "acme": {
      "$ref": "#/$defs/acmeRef",
      "description": "Administrator-registered ACME binding (directory URL, account and optional EAB reference live in Runner configuration)."
    },
    "dns": {
      "$ref": "#/$defs/bindingRef",
      "description": "Administrator-registered DNS provider binding."
    },
    "store": {
      "$ref": "#/$defs/bindingRef",
      "description": "Administrator-registered certificate store binding."
    }
  },
  "$defs": {
    "identifier": {
      "type": "string",
      "maxLength": 64,
      "pattern": "^[A-Za-z0-9][A-Za-z0-9_-]{0,63}$"
    },
    "bindingRef": {
      "type": "object",
      "additionalProperties": false,
      "required": ["binding"],
      "properties": {
        "binding": {
          "type": "string",
          "maxLength": 63,
          "pattern": "^[a-z0-9]([a-z0-9-]{0,61}[a-z0-9])?$",
          "description": "Logical name resolved from administrator-provided configuration on the Runner side. Never a credential, connection string or resource identifier."
        }
      }
    },
    "acmeRef": {
      "type": "object",
      "additionalProperties": false,
      "required": ["binding"],
      "properties": {
        "binding": {
          "type": "string",
          "maxLength": 63,
          "pattern": "^[a-z0-9]([a-z0-9-]{0,61}[a-z0-9])?$",
          "description": "Logical name resolved from administrator-provided configuration on the Runner side. Never a credential, connection string or resource identifier."
        },
        "account": {
          "$ref": "#/$defs/acmeAccountRef",
          "description": "Selects a generation-scoped ACME account on the Runner. Absent means the legacy, unversioned account state."
        }
      }
    },
    "acmeAccountRef": {
      "type": "object",
      "additionalProperties": false,
      "required": ["generation"],
      "properties": {
        "generation": {
          "type": "integer",
          "minimum": 1,
          "maximum": 1000000,
          "description": "1..MaxAccountGeneration. Generations are never reused."
        },
        "provisioning": {
          "$ref": "#/$defs/sealedProvisioning",
          "description": "Present only on the run that registers this generation."
        }
      }
    },
    "sealedProvisioning": {
      "type": "object",
      "additionalProperties": false,
      "required": ["version", "keyId", "ephemeralPublicKey", "nonce", "ciphertext"],
      "description": "An EAB (kid + hmac) sealed to a Runner provisioning key. Opaque to everything but the Runner holding the matching private key; the exact scheme is Go-only (pkg/api/v1alpha1/provisioning.go) and not expressible in JSON Schema.",
      "properties": {
        "version": {
          "const": "x25519-hkdf-sha256-a256gcm/v1"
        },
        "keyId": {
          "type": "string",
          "pattern": "^[0-9a-f]{16}$",
          "description": "16 lower-case hex characters identifying the Runner provisioning key this was sealed to."
        },
        "ephemeralPublicKey": {
          "type": "string",
          "pattern": "^[A-Za-z0-9_-]{43}$",
          "description": "base64url (no padding) of a 32-byte X25519 public key (32 raw bytes = 43 unpadded base64url characters)."
        },
        "nonce": {
          "type": "string",
          "pattern": "^[A-Za-z0-9_-]{16}$",
          "description": "base64url (no padding) of a 12-byte AES-GCM nonce (12 raw bytes = 16 unpadded base64url characters)."
        },
        "ciphertext": {
          "type": "string",
          "minLength": 23,
          "maxLength": 5483,
          "pattern": "^[A-Za-z0-9_-]+$",
          "description": "base64url (no padding) AES-256-GCM ciphertext with the authentication tag appended. minLength/maxLength bound the character count (23..5483 characters, i.e. roughly 17..4112 decoded bytes); Go validation checks the exact decoded byte range, which this schema cannot express."
        }
      }
    }
  }
}
