{
  "apiVersion": "acme-conductor.cits-nue.github.io/v1alpha1",
  "kind": "CertificateReconcileJob",
  "runId": "01JABCDEFGHJKMNPQRSTVWXYZ0",
  "target": {
    "id": "01JABCDEFGHJKMNPQRSTVWXYZ1",
    "fqdn": "wiki.example.ac.jp",
    "revision": 3,
    "additionalNames": [
      "www.example.ac.jp",
      "portal.example.ac.jp"
    ]
  },
  "policy": {
    "allowedDnsSuffixes": [
      "example.ac.jp"
    ],
    "allowWildcard": false,
    "renewBeforeDays": 30,
    "keyType": "ec256",
    "maxSANs": 3
  },
  "acme": {
    "binding": "letsencrypt-staging"
  },
  "dns": {
    "binding": "azure-dns-staging"
  },
  "store": {
    "binding": "filesystem-dev"
  }
}
