{
  "apiVersion": "acme-conductor.cits-nue.github.io/v1alpha1",
  "kind": "CertificateReconcileJob",
  "runId": "01JABCDEFGHJKMNPQRSTVWXYZ0",
  "target": {
    "id": "01JABCDEFGHJKMNPQRSTVWXYZ1",
    "fqdn": "wiki.example.ac.jp",
    "revision": 3
  },
  "policy": {
    "allowedDnsSuffixes": ["example.ac.jp"],
    "allowWildcard": false,
    "renewBeforeDays": 30,
    "keyType": "ec256"
  },
  "acme": {
    "binding": "letsencrypt-staging",
    "account": {
      "generation": 1,
      "provisioning": {
        "version": "x25519-hkdf-sha256-a256gcm/v1",
        "keyId": "1a92f23852dc908d",
        "ephemeralPublicKey": "zo060cy2M-x7cMF4FKXHbs0CloUFDTRHRboFhw5YfVk",
        "nonce": "AwMDAwMDAwMDAwMD",
        "ciphertext": "19JXJr3se_7zmhhjCyaLm2k01b7-Uy7srjEt4Simh9IcCgXD8vTjBAkHYYGvYlKs0yB7RcT3OPeRsDE3CEFXbogqQCajAAtYvg"
      }
    }
  },
  "dns": { "binding": "azure-dns-staging" },
  "store": { "binding": "filesystem-dev" }
}
